0.0,2.04,我們手收益聽過這樣的話
2.04,4.24,石油這過三四年就要用光了
4.24,5.84,除了要幾元能源
5.84,7.92,並開發太陽能風力等
7.92,9.88,一面地球自願耗接
9.88,11.64,等到了2023年
11.64,13.76,當年小朋友也變成大輸了
13.76,15.72,如今石油是越來越多
15.72,17.68,油就還崩跌了好幾次
17.68,20.16,墨飛石油用光洗澡片劇
20.16,22.76,那今天我們就要聊聊石油歷史
22.76,25.32,人類美麗5千年前就發現了石油
25.32,27.400000000000002,為甚麼錢的石油這麼難用
27.400000000000002,29.72,現在就經常會石油帶老出手
29.72,31.119999999999997,還越完越多呢
32.12,33.56,能不能再聊歷史錢
33.56,36.28,我們點線的歐解下石油是如何擔身的
36.28,37.519999999999996,1956年
37.519999999999996,39.36,美國地址學校差不多
39.36,41.239999999999995,提出了石油風紙論
41.239999999999995,43.519999999999996,逃遇據美國的石油產量
43.519999999999996,46.0,將在1900年左右打到天風
46.0,47.92,之後就會主見下降
47.92,50.519999999999996,它認為石油是有骨的生物產害
50.519999999999996,52.879999999999995,如空龍、三葉蟲、絕類等
52.879999999999995,54.32,他們的話實
54.32,56.8,這地底下經過高溫高壓環境
56.8,58.92,逐漸對基層定而成
58.92,60.72,因此石油是有限的
60.72,63.0,等這些會說法存在很多爭議
63.0,65.12,不過只有人被寫進著合輸
65.12,66.84,也是那麼小時候看到的
66.84,68.92,石油像在五十年後進
68.92,70.92,石油庫解說由來
70.92,72.92,活育生物產有理論的爭議
72.92,75.12,第一個是沒有任何科學實戰
75.12,77.12,因為不可能從現動植物一體
77.12,78.72,轉變石油過程
78.72,81.12,其實這些許多不排生物的地層中
81.12,82.92,也能挖到不少石油
82.92,84.12,切私金上
84.12,85.6,生物一海大陸被為生物
85.6,87.12,曾經和細菌會收
87.12,88.52000000000001,一海草被買仗
88.72,91.32,第一卷上那種這麼多生物被買的地下
91.32,93.52,然後產生書一種石油呢
93.52,95.52,因此有理拍說法
95.52,97.11999999999999,5G生成理論
97.11999999999999,99.32,認為石油與生物產還無關
99.32,101.52,石油是有地球內部的物質
101.52,103.11999999999999,經過化學反映後
103.11999999999999,104.72,形成這種框物質
104.72,106.72,石油除了也沒那麼有限了
106.72,108.12,因為這些物質
108.12,110.52,在地球形成出奇究竟存在
110.52,112.52,因此只要裝更生的有盡
112.52,114.52,就可以獲取更多石油
114.52,116.72,但5G生成理論也有很多罷格
116.72,118.32,相信人民不多
118.32,119.52,造這個理論
119.52,121.92,越生物地殼就越多有才對
121.92,123.52,但正與事實不服
123.52,125.12,而且有發節是
125.12,127.92,石油複雜的化學成分組成因素
127.92,130.52,總之這樣拍說法一針指揮100年
130.52,132.12,都有矛盾支出
132.12,134.92,目前石油成因還是個迷
134.92,136.52,但不會兩個正確
136.52,138.52,人類很早就發現了石油
138.52,140.12,不過現在石油工業
140.12,141.72,石魚是有石魚中業
141.72,143.92,而真正大會墨的石油
143.92,145.92,把石油當成重要的原
146.11999999999998,147.51999999999998,甚至不過100多年
147.72,148.72,這是為什麼
149.11999999999998,150.72,人類早在5000年前
150.72,152.32,就知道石油存在
152.51999999999998,154.72,能一個石油全成的地下有氣
154.72,156.72,或因此利益放五勇要地面
156.72,158.92,貿出你互富生色議題
158.92,160.92,甚至直接形成的力氣圖
160.92,163.92,這次原內的直接取得原原方式
163.92,165.92,石油這種聯合或東西
165.92,168.72,整天的時候可以用來固定石氣與木巴病
168.72,170.11999999999998,出了連鑽性外
170.11999999999998,171.51999999999998,力氣很防水
171.51999999999998,173.72,且在銀廣泛那九線高
173.72,175.72,因此中國人巴比倫人
175.72,178.52,會到力氣來圖墨在建築物傳之上
178.52,181.12,以方之水的滲透還水清石
181.12,182.92,據說模型的奴隙方州
182.92,184.92,從力到外都墨力清
184.92,187.12,力氣雖然不像鑽電器有一樣
187.12,188.52,以獄火就燃燒
188.52,189.52,等力氣也是一種
189.52,191.32,可然的半流體物質
191.32,192.52,可以用來照明
192.52,194.32,只是因為力氣是在很年
194.32,195.32,不良就算了
195.32,197.12,燃燒是還會產生黑陰
197.12,199.12,把物質寻的武器麻黑的
199.12,200.72,因此不收鑽賴
200.72,201.92,水物鑽電賴
201.92,203.32,石油就作為防水
203.32,204.72,連鑽機的存在
204.72,206.12,我還被當成武器
206.12,208.12,例如巴爾廷地國住民的武器
208.12,209.12,希臘火
209.12,211.32,石油中可以在水上燃燒火焰
211.32,212.72,也因為希臘火
212.72,215.12,巴爾廷地國多次敵於敵人的進攻
215.12,217.52,是遜命千年的明明武器
217.52,219.32,但是石油也不夠就這樣子了
219.32,220.52,人們可不像現在
220.52,222.12,會為了需要打仗
222.12,223.52,石油會變成這麼強奏
223.52,226.12,讓它是會變成了一種動力來源
226.12,228.12,整人內辦場的地時中
228.12,230.12,能源轉換一個是個大問題
230.12,232.72,追蹤人們不用火來通組練貼
232.72,234.52,不用風力來推動反傳
234.52,236.52,用石材來連秘魔古物
236.52,238.52,等於鑽都用所限制
238.52,240.12,如果力要錢木材
240.12,241.52,風力得靠老天
241.52,243.12,水力一點有水
243.12,245.12,且這些的運物法互相轉換
245.12,246.72,如風力可以形傳
246.72,248.12,卻沒辦法組繃
248.12,249.72,而活力可以組繃
249.72,251.92000000000002,卻沒辦法連秘或形傳
251.92000000000002,253.52,如果想要轉換的那樣
253.52,255.52,就得有人力或受力才新
255.52,256.92,等人類與其他動物
256.92,258.72,也需要吃飽了才有力氣
258.72,260.92,再把那樣轉買動能
260.92,262.12,這幾問題遮等到
262.12,264.12,整體幾萬時候才解決
264.12,265.72,整幾幾幾起來說
265.72,267.52,就是暫時操某種軟掉
267.52,268.44,例如沒
268.44,270.52,這產生熱能降水組繃
270.52,272.02,以產生爭氣
272.02,273.62,今的爭氣推動火材
273.62,275.12,讓火材得很運動
275.12,277.62,只要變可以降熱能轉為動能
277.62,279.22,如最早的爭氣機
279.22,280.92,是為了抽取礦景的水
280.92,283.16,也要不然選到我忍力累了半死
283.16,285.56,空忧來爭氣機運動到了其他領域
285.56,287.58,如風之機革命機上
287.58,290.28000000000003,甚至是跨時代發明爭氣火車
290.28000000000003,292.36,爭氣火車的背景傳統我馬車
292.36,294.16,速度更快再會讓更大
294.16,295.56,切成分更低
295.56,296.96000000000004,也為這個樣子
296.96000000000004,299.76,整體機帶到了共產品的革命與中文革命
299.76,301.86,此入人類如同找了魔
301.86,304.36,風空研究如何使用機器和隱形
304.36,305.96000000000004,轉換各種能量
305.96,307.35999999999996,1846年
307.35999999999996,308.76,現在大的技師
308.76,309.96,發明了頭美探中
309.96,311.35999999999996,提取沒有方法
311.35999999999996,313.15999999999997,每多久1852年
313.15999999999997,314.96,突然的烏卡線為期
314.96,316.56,發明了更簡單的方式
316.56,318.46,從私優中提取沒有
318.46,319.96,過去人類的照明
319.96,321.96,是使用經由或是大族
321.96,324.15999999999997,不但這樣的能貴且小綠低
324.15999999999997,325.65999999999997,但沒有就不同了
325.65999999999997,327.35999999999996,沒有照明上我更好
327.35999999999996,329.15999999999997,且攜帶方便又便宜
329.15999999999997,330.96,石優就遠來越重要
330.96,333.35999999999996,也順便就有基於這個可愛的物種
333.56,334.76,不需要超過他們腦袋
334.76,336.16,或許已經流了
336.16,337.96000000000004,加上快採技術的越進
337.96000000000004,339.16,現在的內容倉
339.16,340.56,低口現在有進
340.56,342.56,都在這個時候擔升
342.56,344.96000000000004,有了需求量成量有大增下
344.96000000000004,346.76,石優產業和魔發展
346.76,348.96000000000004,也出現許多石優公司
348.96000000000004,350.76,不過這個時候石優
350.76,352.56,只是為了體電有的冷料
352.56,353.56,說很重要
353.56,354.56,其實還好嗎
354.56,356.16,當時的動力來源
356.16,357.76,主要是爭氣機
357.76,359.16,但爭氣界的冷料
359.16,360.96000000000004,是在氣候外面的冷処
360.96000000000004,362.96000000000004,因此動能很容易散失
363.15999999999997,364.35999999999996,效率並不好
364.35999999999996,365.96,為了解決這個問題
365.96,367.35999999999996,1876年
367.35999999999996,368.96,德姑樂科學家奧托
368.96,370.76,石優是現在的冷料沒有
370.76,373.15999999999997,發明了直接在氣候內冷処引擎
373.15999999999997,374.76,也覺得內冷機
374.76,376.76,內冷機比登進機體級更小
376.76,378.15999999999997,但跑了更強
378.15999999999997,379.96,也不用上了陣進機一樣
379.96,381.56,需要預熱或冷卻
381.56,384.15999999999997,更適合現在工業和輸出需求
384.15999999999997,387.35999999999996,真是宣告了陣進時代幾乘結束
387.35999999999996,389.76,但沒有的冷量沒獨低體級大
389.76,391.96,需要很大的冷料出現空間
392.15999999999997,394.15999999999997,因此次沒有的內冷機
394.15999999999997,396.35999999999996,效率低下並為流行
396.35999999999996,399.35999999999996,不過隨著內冷我技術和化學知識的發展
399.35999999999996,401.15999999999997,科學家整公雄使有中
401.15999999999997,402.96,體驗出彩油和氣油
402.96,404.15999999999997,比起沒有
404.15999999999997,405.56,彩油氣油的冷點高
405.56,406.76,冷消速度快
406.76,408.76,可以出出更多的能量
408.76,410.15999999999997,於是1855年
410.15999999999997,411.96,平時的穿滿冷淡穩的
411.96,414.35999999999996,發明了一氣油為然調的內冷機
414.35999999999996,415.56,內冷機與電力
415.56,417.76,也得讓我低了四孔面革命
417.76,420.15999999999997,人類的科技體級土非猛進的發展
420.16,422.56,氣油內冷機的體級小效能更高
422.56,424.96000000000004,測得以改變的人們的角度方式
424.96000000000004,427.56,各種使用氣油的氣層模操
427.56,429.76000000000005,以及穿至於分析工具的普及
429.76000000000005,431.16,加上電力的出現
431.16,433.36,讓使油的需油大增
433.36,435.16,使用一次期待每探
435.16,436.96000000000004,成為新的冷人之王
436.96000000000004,439.56,低測進入了使油時代
439.56,442.16,使用不簡單的工業與裝潢革命
442.16,444.76000000000005,有所有的影響國家或政權的新衰
444.76000000000005,446.16,一戰很結束後
446.16,448.96000000000004,輸入烏激到現在的野賽敗然發酷的油填
448.96,451.76,公務宇的輸入了90%的使用需求
451.76,452.96,則在期間
452.96,455.15999999999997,期待熱發動了大臨革流戰役
455.15999999999997,457.35999999999996,就出了多取法會有天
457.35999999999996,458.76,不過戰爭實力
458.76,460.96,最終老師第三地國瓦解
460.96,463.15999999999997,冷戰期間的依舊的青年代
463.15999999999997,465.35999999999996,輸入烏激進出現嚴重問題
465.35999999999996,467.96,但還要依舊青山點的使用危機
467.96,469.96,讓蘇聯經濟得與俗幻
469.96,472.35999999999996,也讓蘇聯回光反造了10年
472.35999999999996,474.35999999999996,遠遠不斷的使用財富
474.35999999999996,476.15999999999997,讓蘇聯的體現時珠
476.15999999999997,478.35999999999996,甚至有淋價美國的氣勢
478.36,480.16,石油充足的蘇聯
480.16,482.96000000000004,現在任何看著西方資本主義國家
482.96000000000004,484.96000000000004,把我受使用為借江老
484.96000000000004,486.16,等1981年
486.16,488.36,美國總統雷根宣似就職
488.36,489.76,一番神超做下
489.76,491.76,國際有架印神大敵
491.76,493.56,敵到美統我只剩8元
493.56,496.16,都會蘇聯來說整治市回憶現的打擊
496.16,498.56,也間接導至蘇聯的結體
498.56,499.76,二戰整束後
499.76,501.36,全球景氣復蘇
501.36,503.76,加3個戰前的化學工業發展
503.76,505.96000000000004,人們又發現的石油可以當然了外
505.96000000000004,508.16,還能生產塑膠和成仙為
508.16,509.76000000000005,醫療化妝容平等
509.76000000000005,511.76000000000005,石油可說是工業寫賣
511.76000000000005,513.76,隨便人口爆炸層實話
513.76,515.96,人們的生活也離不開石油
515.96,518.36,全世界有一般的石油集中在中東
518.36,520.96,但是這許多種東西有土豪國家
520.96,522.76,可以推出這初幾億年前
522.76,524.5600000000001,或雖然地區在這邊還一樣
524.5600000000001,526.1600000000001,生物統類的豐富
526.1600000000001,527.76,一生物前有理論來看
527.76,529.5600000000001,石油是有生物的實體
529.5600000000001,531.1600000000001,在封木裡的是一顆中
531.1600000000001,532.96,經過千百萬年
532.96,535.5600000000001,甚至是上億年的高溫級下下變成
535.56,538.3599999999999,因此中東停空的很好地的造化環境
538.3599999999999,540.56,中東又位於板塊的小姐處
540.56,541.76,極限萬年來地殼
541.76,545.16,不讓火動後來復改與破酸的海洪退去
545.16,547.56,中東變成了乾燥的不矛指定
547.56,549.3599999999999,自然地底生出的油氣
549.3599999999999,550.9599999999999,足夠就被非常有地下
550.9599999999999,552.3599999999999,不被外界乾燥
552.3599999999999,554.3599999999999,而後期地殼又去穩定
554.3599999999999,556.3599999999999,成為一個良好的除火環境
556.3599999999999,559.3599999999999,想像中東地區還真的很少地站的
559.3599999999999,561.56,因為按照有多久的地區原地
561.56,563.16,地增會讓你乎我石油
563.16,564.9599999999999,有像更深的地層
564.96,566.76,此為單純的氣候和地形
566.76,568.96,也讓石油比較容易看開開
568.96,570.1600000000001,成本跟低
570.1600000000001,572.36,這也是為甚麼世界各地的石油
572.36,574.96,但就有中東的石油追究竟真例
574.96,576.36,不過會在結束後
576.36,578.36,中東國家中地全府為黑
578.36,580.5600000000001,沒有技術石油也挖不出來
580.5600000000001,582.96,因此石油都被歐洲國家所壟斷
582.96,585.96,包含了荷蘭、英國、農為一大利等
585.96,587.76,樹村石油、七屆美
587.76,589.96,這一肉圈典代的全身時期
589.96,593.5600000000001,七屆美控制了全世界百分之八十五的石油圖這樣
593.56,595.3599999999999,後來中東國家有錢的
595.3599999999999,597.16,認為自己有技術
597.16,598.56,說話還要大聲
598.56,600.16,不想說後語人
600.16,601.9599999999999,實在1960年
601.9599999999999,603.56,以商務地牢部為首
603.56,605.9599999999999,成立歐佩克石油樹出國主之
605.9599999999999,607.9599999999999,來西地統一石油價格
607.9599999999999,609.76,一保護成員國立意
609.76,612.3599999999999,石油為幾後期前面也就沒用了
612.3599999999999,613.56,1973年
613.56,615.3599999999999,第四次中午三的爆發
615.3599999999999,618.16,簡單的就是以色列等條要全牢部國家
618.16,619.9599999999999,雙唇有難以四手了
619.9599999999999,621.9599999999999,何況以色列意大是幾國
621.96,623.5600000000001,與是跟美國之求就
623.5600000000001,625.36,至少歐佩克就不爽了
625.36,627.5600000000001,成員國分分定值是由出口
627.5600000000001,630.1600000000001,以保護西方國家支持以色列
630.1600000000001,632.76,導致的是由價格上上了1300
632.76,634.76,造成全球經濟崩潰
634.76,637.36,這就是一種七三年的石油為機
637.36,638.96,這一次是今後
638.96,641.5600000000001,由許熱認為石油不是許知不見的
641.5600000000001,643.96,石油將在三十到五十年後哭解
643.96,645.5600000000001,但五十年過去了
645.5600000000001,647.1600000000001,石油還是很多
647.1600000000001,648.96,則到底怎麼一回事呢
649.76,651.1600000000001,究竟一學的觀點
651.1600000000001,652.76,石油永遠挖不完
652.76,654.36,因為石油只要減少
654.36,655.76,價格就還盤身
655.76,657.76,當盤身到底定得高度後
657.76,659.5600000000001,人們就不會再使用石油
659.5600000000001,661.76,而會尋找石油的替代品
661.76,663.36,或是我尋找現在難以開彩
663.36,664.5600000000001,成本高油填
664.5600000000001,666.5600000000001,和我將變得有力可圖
666.5600000000001,668.1600000000001,如果一定五年以前
668.1600000000001,669.4000000000001,有就要常期為此在
669.4000000000001,671.1600000000001,美同二十到四四美元
671.1600000000001,673.36,對比超加要不得開的成本
673.36,675.1600000000001,美同我不知道石美元
675.1600000000001,676.96,美日可產一千萬同
676.96,678.76,可說是非常好賺
678.76,680.36,二領零零八年有加大招
680.36,682.76,原油標是當我每同一百四七美元
682.76,685.16,導致要模圖好又更有權了
685.16,687.76,原因為百四七美元的歷史田架
687.76,690.16,連石油開彩成本高的穩定瑞拉
690.16,692.16,身體都一整個起來
692.16,694.56,即使的高率論推動了其處發展
694.56,696.56,美日過熱影有很空足事
696.56,698.56,熱影有是有熱影的碎片
698.56,700.96,透過複雜方式提電而成
700.96,702.96,開彩需要很高技術
702.96,705.56,熱影有成本我一同四十到六十美元
705.56,708.16,而過去是總價格的二十到四四美元
708.36,709.9599999999999,可說是蠻一同培一同
709.9599999999999,711.9599999999999,但在高油價的加持下
711.9599999999999,713.9599999999999,也有開始有力可圖
713.9599999999999,715.9599999999999,零一種非常有石油
715.9599999999999,717.36,石架大油沙
717.36,718.56,過敏思義
718.56,720.9599999999999,四重就要沙中體電石油
720.9599999999999,723.36,油沙開彩比也有更困難
723.36,724.9599999999999,需要更高技術
724.9599999999999,727.56,成本高大美同四十到九十美元
727.56,728.9599999999999,在產品時期
728.9599999999999,731.16,油沙子人在角落我化全圈
731.16,732.56,根本沒人離他
732.56,734.16,但只要油價高長
734.16,735.9599999999999,油沙就會重新將乎
735.9599999999999,737.9599999999999,如一種奇詐技能的石油近距
738.36,740.36,依舊去重點的一朗革命
740.36,742.36,依舊有零點的破爽戰爭
742.36,744.76,零零三點的入青一拉克
744.76,746.36,與最近的偶戰爭
746.36,747.76,只要油價一標長
747.76,749.96,油沙就會有開彩的價值
749.96,751.76,雖然油價都會回問
751.76,753.76,但技術總數的進步
753.76,755.5600000000001,這科學家的努力下
755.5600000000001,757.76,也有有差成本不斷下降
757.76,759.96,石油就會通通的停電出來
759.96,761.5600000000001,且不止也有油沙
761.5600000000001,763.5600000000001,還有許多費權總是石油
763.5600000000001,765.36,上來被人類所利用
765.36,767.5600000000001,如生害石油即地石油
767.56,769.9599999999999,他們沒常在生害與動徒之中
769.9599999999999,771.9599999999999,開彩能度大成本高
771.9599999999999,774.56,等於潛在處量非常驚人
774.56,775.76,所以簡單說
775.76,777.16,過去的低油價
777.16,779.3599999999999,讓高層的石油難以開彩
779.3599999999999,780.9599999999999,但是又穿了標長
780.9599999999999,782.76,新的人技術不斷進步
782.76,785.3599999999999,以前成本高石油都能獲得利潤
785.3599999999999,786.56,且主見的
786.56,788.9599999999999,流許多新的人都能取代石油
788.9599999999999,791.9599999999999,如電用車可以利用這層的原進行充電
791.9599999999999,793.9599999999999,它浮降低石油的需求
793.9599999999999,796.3599999999999,我們才會有石油用不然的感覺
796.36,799.16,而電用車並不是什麼2014G的新科技
799.16,801.5600000000001,卡拉的利紙甚至比氣油車還造
801.5600000000001,804.16,石油世界墨到4G的城市年
804.16,806.16,當中這是馬車曾經氣超
806.16,807.76,電動機車的氣油氣超
807.76,809.96,4種車子的變成17
809.96,812.16,其中馬車就先被其他淘汰
812.16,813.96,一些氣車製造商
813.96,816.36,也無法預測3種引擎的前進
816.36,819.16,石油同生產3種弄率的氣超
819.16,820.16,1910年
820.16,822.5600000000001,奔重的真性引擎雖然出局
822.5600000000001,824.5600000000001,5年後我作價能夠有電動車
824.5600000000001,825.96,也不理油車
825.96,827.96,追蹤氣用引擎推輪了出
827.96,829.76,並沉霸到現在
829.76,831.5600000000001,石油生好用沒有錯了
831.5600000000001,834.76,但前面說了石油不是取制不進
834.76,837.5600000000001,更重要是石油等化石藍料
837.5600000000001,839.5600000000001,會排放大量的溫室氣體
839.5600000000001,841.96,造成群有冷化和其有面簽
841.96,845.1600000000001,為此人類不斷尋造可以提帶石油的原
845.1600000000001,846.76,這就是能源轉型
846.76,847.96,這一位如此
847.96,849.1600000000001,100年後
849.1600000000001,850.96,這電子技術突破後
850.96,852.76,電動車的轉動從來
852.76,854.76,年容簽訂商店成立的特斯拉
854.76,856.16,透過改善流程
856.16,858.36,大幅降低電池的成本
858.36,860.36,成為電動車的領頭央
860.36,861.76,在有靈惡而言
861.76,863.76,電動車在新車的小說比
863.76,865.96,達到率子新高的百分之十
865.96,868.36,宣告性的人時代到來
868.36,870.56,台灣的約98養來進口
870.56,871.76,又是導國
871.76,873.56,沒辦法跟靈國買電力
873.56,875.76,能源轉型是我們努力的目標
875.76,878.36,無以此體下炸至有一期電的生活報導
878.36,880.36,停下炸至最終台灣的轉型成立
880.36,881.36,達40年
881.36,881.96,沒有錯
881.96,882.96,就40年
882.96,884.36,1985年
884.36,886.36,停下炸至第5餐企業報導
886.36,887.16,這一年
887.16,889.36,原本做鞋子的環東鞋業
889.36,891.36,就已經跨入了汽車電子領域
891.36,893.16,成立了環東電子公司
893.16,894.36,與環東一樣
894.36,896.36,這些做鞋作為輔助的投拍
896.36,898.36,以及做塑造的存產業者
898.36,900.76,與我台灣重要的企業的彈性與認性
900.76,903.76,分分在這一年轉往新型的電子領發展
903.76,904.76,40年後
904.76,906.36,這些人這些產縣
906.36,908.5600000000001,分分成為特斯拉的公民念
908.5600000000001,910.16,往新式機賣進
910.16,911.76,與原特斯拉的公民念
911.76,913.56,還問早在1985年
913.56,915.16,就超懸部署
915.16,916.56,2015年
916.56,917.76,特斯拉的技術長
917.76,919.76,也是共同穿版人是特勞輩
919.76,921.16,親自的要台灣
921.16,922.56,然後為特斯拉的手款
922.56,923.36,就用跑車
923.36,924.9599999999999,羅斯特拉的公民念
924.9599999999999,927.76,最終早上的台中成功的副田天機
927.76,930.16,當時副田的卷空師不到80人
930.16,931.36,只是特斯拉更小
931.36,932.56,不到60人
932.56,935.16,副田稱為了特斯拉所加的台灣公民商
935.16,936.9599999999999,副者作為羅斯特拉馬達
936.9599999999999,938.9599999999999,因為國內的新物大廠貿聯
938.96,940.96,也是特斯拉的第一代客戶
940.96,942.36,只是2009年
942.36,943.96,因為特斯拉的公司戰略
943.96,945.96,特斯拉把產縣移回美國
945.96,947.76,關閉的台灣分公司
947.76,949.36,雖然特斯拉超級的台灣
949.36,951.76,但是現金特斯拉人有70%的領建
951.76,953.5600000000001,都有台灣的公民商製造
953.5600000000001,955.5600000000001,包括車店系統往馬達動力
955.5600000000001,957.36,電子車三語衝生系統
957.36,958.96,有居然是獨家公民移
958.96,961.76,現在電動車是新人員的美日之心
961.76,964.1600000000001,而台灣以固的靜止省溫泳卿
964.1600000000001,965.96,其實在1970年
965.96,967.76,就看到了這個趨勢
967.76,969.16,它要的暑空寫道
969.16,971.16,電動車是創始機事業
971.16,972.76,也是下色界主流
972.76,974.36,它其下的台出集團
974.36,977.16,也會均近均起車製造於電子研發
977.16,979.36,只是後來發展是與願為
979.36,981.16,事件執審一生之中
981.16,983.36,商場上少數的遺憾
983.36,984.36,直到去年
984.36,986.16,台出決定亦亦能從來
986.16,987.76,要查也百就是一台幣
987.76,989.76,打造成了市內的時代六千
989.76,990.96,要在兩人之內
990.96,993.36,建成台灣最大的電池前面長
993.36,994.96,要幫我往近遠夢
994.96,997.36,有利礦勢的電池的主號原料
997.36,999.76,禮礦對於現在可以產業非常重要
999.76,1001.76,除了入於電動車的旅電池外
1001.76,1003.36,禮礦又與生產電腦
1003.36,1006.16,所接頻版和其他智能裝置的電池
1006.16,1008.5600000000001,禮礦也是各種和盡和化學品的原料
1008.5600000000001,1010.96,和說上個世代的白色黃金
1010.96,1011.96,40年前
1011.96,1014.16,天下的這看見的能源轉向重要
1014.16,1015.16,40年後
1015.16,1017.5600000000001,依然為台灣人關注這個重要IT
1017.5600000000001,1018.76,今年而愈人
1018.76,1020.5600000000001,天下的自派出舞台牌記者
1020.5600000000001,1022.36,前往地球另一端之力
1022.36,1024.76,之地全世界最大的禮辭產國之一
1024.76,1026.76,真世界總產量的建議辦
1026.76,1028.36,天下的這次選台灣第一個
1028.36,1030.16,生入之地禮礦覺得沒替
1030.16,1031.96,人工比台灣少了之地
1031.96,1033.56,將於決定而禮三年年
1033.56,1034.96,全球三年五一亮
1034.96,1036.16,電動車的未來
1036.16,1037.16,天下的這次的記者
1037.16,1038.76,帶我們前往之地北部
1038.76,1040.76,生入礦居門護城市卡拿馬
